id,title,selftext,score,num_comments,author,created_utc,url,over_18,edited,spoiler,stickied
19difxp,Is the Data Space really this Complicated or am I just overthinking?,"For some reason, everytime I try to learn I see new tools and how they ease the existing work. And I end up wasting more time where if I spent that on actually learning, I would be way ahead. How do you know which tool to pick and choose(from the noise in the market) ?

https://preview.redd.it/ji5thy5f05ec1.png?width=2013&format=png&auto=webp&s=167f4e2afce621cc135d5a0ff7d5c484fedaa032",56,60,_areebpasha,2024-01-23 06:55:02,https://www.reddit.com/r/dataengineering/comments/19difxp/is_the_data_space_really_this_complicated_or_am_i/,False,False,False,False
19d6f86,First time connecting to an API,"Backstory - First let me say I’m a newish BI analyst and in a department of me. We are starting to develop a data culture but I need to show value. I’m using PBI and made several reports from on prem databases. 

My goal is to connect to an API and put the acquired data into a MS Access database. The API returns the data in JSON format. 

I’ve written a very simple Python program that pulls the data from the API on a daily basis and places it in a JSON file to be consumed by PBI. 

I’m not a data engineer by any stretch of the imagination but I figured this would be the right sub to ask this question. 

Is it possible for Python to pull the data from the API and insert into an Access database while also performing some ETL? Am I in way over my head if I’m very new to Python?",27,18,jebert32,2024-01-22 21:08:49,https://www.reddit.com/r/dataengineering/comments/19d6f86/first_time_connecting_to_an_api/,False,False,False,False
19de5wg,Entry level + Fully Remote... How unrealistic?,"My goal is to get a fully-remote, entry-level job in data engineering. How unrealistic is that?

Be brutally honest... better to crush my dreams now rather than study for months only to find out later.

I have no experience in data engineering, but I do have a phd in a stem field and 4 years working as a data scientist",15,39,KimchiFitness,2024-01-23 02:52:12,https://www.reddit.com/r/dataengineering/comments/19de5wg/entry_level_fully_remote_how_unrealistic/,False,False,False,False
19djant,ETL pipeline from SQL Server to Postgres,"Im currently working on an ETL pipeline to move tables from SQL Server on a server to Postgres on another server, and then do operations on those tables in Postgres on a daily schedule. Some of those tables contain geospatial data.

I currently implemented the pipeline through python scripts using pandas and sqlalchemy

For tables with spatial data I use geopandas and geosqlalchemy

The process is functional so far but it takes too long to move large tables 

How can I speed up moving tables from SQL Server to Postgres? What kind of tools/ideas would be better to implement?",10,19,bolt_runner,2024-01-23 07:53:08,https://www.reddit.com/r/dataengineering/comments/19djant/etl_pipeline_from_sql_server_to_postgres/,False,False,False,False
19d4lq3,"my path on being a data engineer, advice?","have an education in software development check.

do allot of courses on courserea and build a portfolio

get a data analyst job

get a data engineer job after a few years.

&#x200B;

dont know if it matters but im in canada.

&#x200B;

edit:just wanted to say thank you all for being so positive.",12,4,BornYoghurt8710,2024-01-22 19:54:20,https://www.reddit.com/r/dataengineering/comments/19d4lq3/my_path_on_being_a_data_engineer_advice/,False,False,False,False
19dde12,What do you do with depreciated applications in your code base?,"I recently launched a POC data pipeline and now that it’s seeing production workloads I want to refactor it. It’s like a combination of 3 data pipelines, synchronously working, and I want to turn it into 3 smaller pipelines that run asynchronously.

I figure this will result in three smaller projects that steal code from the POC and depreciation of the POC. So, what is typically done to the POC?

I use git like most.",8,7,DuckDatum,2024-01-23 02:13:46,https://www.reddit.com/r/dataengineering/comments/19dde12/what_do_you_do_with_depreciated_applications_in/,False,False,False,False
19dry3i,What do you think about Apache Pulsar?,"Pulsar is a robust data streaming and messaging platform, similar to Kafka, but with more features out-of-the-box like schema-registry, multi-tenancy, geo-replication, and tiered storage.

It has been an Apache top-level project since 2018 ([https://pulsar.apache.org](https://pulsar.apache.org/)). Many big companies like Tencent, Discord, Flipkart, and Intuit use it.

Unlike Kafka, it processes messages individually, instead of just using offsets. Horizontal scaling is painless in comparison with Kafka, thanks to the separation of compute and storage nodes. Supports millions of topics.

When I first heard about the Pulsar, I thought my dreams had come true. 🌈🦄

Now I'm trying to understand why there is not much buzz in public about it:

* Is it a marketing flaw and people just didn't ever hear about it?
* Or is there something wrong or missing in Pulsar?
* Maybe it is just an overkill for most new projects?

I would greatly appreciate hearing about your experience and thoughts on Pulsar.",7,8,visortelle,2024-01-23 16:12:17,https://www.reddit.com/r/dataengineering/comments/19dry3i/what_do_you_think_about_apache_pulsar/,False,False,False,False
19dp67h,Am I romanticizing DE?,"Summary:

* B.S. in Microbiology & Chemistry 
* 10 years of work experience - clinical research, teaching, & sales
* No coding experience 
* Strong soft skills
* Currently working fully remote

Debating between nursing school vs a DE bootcamp/master program. I want to retain the flexibility of remote work while gaining hard skills to create stability in my career. My lack of experience in coding makes me nervous, however, I am willing to do what it takes to break into the field. Just need some reassurance...whether it's positive or negative.  

Am I turning this career path into a ""feel good"" dream or is it feasible? 

Much love. ",5,12,ItsWetInPortland,2024-01-23 14:05:53,https://www.reddit.com/r/dataengineering/comments/19dp67h/am_i_romanticizing_de/,False,False,False,False
19d44ul,What questions to ask when deciding on partitioning strategy?,"Partitioning isn't always a win, like any optimization it's a mix balancing trade-offs in favor of the type of workloads that higher priority and seen more often.  


When determining how large data set should be partitioned, what questions do you ask yourself?  


When determining how large a data set should be partitioned, what questions do you ask yourself?  
",4,10,AMDataLake,2024-01-22 19:34:51,https://www.reddit.com/r/dataengineering/comments/19d44ul/what_questions_to_ask_when_deciding_on/,False,False,False,False
19dor5g,How do you decide on resource sizes?,I'm trying to figure out how to size resources for our data pipeline and warehouse. My boss wants me to calculate what each pipeline needs in terms of compute and RAM. Any ideas on how to evaluate and track these requirements? Would love to hear what's worked for you.,3,4,Kindly-Screen-2557,2024-01-23 13:45:40,https://www.reddit.com/r/dataengineering/comments/19dor5g/how_do_you_decide_on_resource_sizes/,False,False,False,False
19dtqiu,DBT for On-Prem ETL,"So, to provide some background, I currently run a very small data team in an industry that’s heavily biased towards on-prem. After facing some limitations with SSIS, we’re looking to move to a more modern ETL solution. My issue is we are currently built to run on-prem ETL while modern architecture seems to focus cloud ELT.

My current setup is as follows: 
1. Extract data from a variety of structured SQL servers (most on-prem, some accessed through VPN. All have direct SQL access)
2. Transform that data using SQL into a more usable, de-normalized format
3. Upload the data into our on-prem data warehouse for analytics. 

A few complicating factors:
1. Several of our vendors are moving to the cloud and I’ll need to export the data via API (and one vendor through snowflake)
2. Our largest data table is under 30 million rows, I don’t expect I need anything more complicated than polars/pandas and SQL
3. In the future, we’d like to be able to ingest and process high frequency (~5-15s) data loaded via 1 hour batches. I don’t need streaming yet nor do I want to implement it. 

Tools I’ve considered:
Mage*
Dagster
Airflow
Pandas/Polars*
DuckDB
DBT*
Minio*

*Current favorite for that role


My thought is, if I’m rebuilding this anyway, would it make more sense to move to an ELT architecture with DBT or maintain my ETL architecture with Python/SQL. What would that look like? Load everything raw into parquet files and process from there? Load raw data into intermediate tables on the same server as the data warehouse? If the majority of my data is already structured, should I bother with parquet? I apologize for the deluge of questions, I’m trying to wrap my head around this new world order after spending too long in the comfortable embrace of SSIS. I appreciate your help!",2,0,Lord_Lloydd,2024-01-23 17:30:25,https://www.reddit.com/r/dataengineering/comments/19dtqiu/dbt_for_onprem_etl/,False,False,False,False
19dtn2u,How to do design a near real-time data job,"I need to create a python app that will output data e.g. every 5s (ideally should be parametrizable to e.g. 10s or 1 day). Input is realtime data stream from RabbitMQ/Kafka. Every 5s app should look into the queue and take all data between defined start and end time - i.e. every run instance should be idempotent as it is defined by static start/end. Job should have some retrying logic in case something fails. App should run in on-premise Kubernetes cluster.

I thought of 3 possible solutions:

a) custom python app with some scheduler such as Airflow that could schedule the app in cluster every 5s

b) custom python app that would run in an infinite loop as standalone pod in the cluster and every 5s or so would do the job

c) use some existing solution that would solve both issues (data logic and scheduling) for me

The issue with a) is we need a robust scheduler that could handle all the job spawns (each 5s, each 10s etc.)

The issue with b) is there is less transparency in case app crashes and also since its only one app in case it crashes all runs that should run after the crash won't run until the app is fixed (scheduler would schedule all the following runs despite previous fails)

The issue with c) is the only potential solution is Prefect but it has memory leak so when we run it for inifity it will eventually run out of memory.

What would be the best approach to implement this?",3,2,romanzdk,2024-01-23 17:26:33,https://www.reddit.com/r/dataengineering/comments/19dtn2u/how_to_do_design_a_near_realtime_data_job/,False,False,False,False
19dsj3n,Pytest on Databricks,"I'm pulling my hear out with this one: 

We've upgraded our cluster from 10.3 LTS, to 13.3 LTS and all the unit tests are not running . For 11.3 and everything in between it's the same.

We even have a simple one that just checks if a given table has data. 

As in: 
assert df.count() > 0 

And for each and every one of them we get: 

OSError: [Errno 95] Operation not supported: 'Workspace/Repos/..../tests/__pycache__'

Test called using
If __name__ == '__main__':
    pytest.main([test_file.py])

Made sure these files are 'files' not 'notebooks', tried to delete them, put them back. Nothing seem to work. 

Any advice?",2,1,albowiem,2024-01-23 16:36:37,https://www.reddit.com/r/dataengineering/comments/19dsj3n/pytest_on_databricks/,False,False,False,False
19dpdzg,How to migrate Hive custom functions to BigQuery UDFs,"Excited to share my latest blog post on migrating Hive UDFs to BigQuery SQL UDFs! Whether you're a data engineer or a CTO, this guide is crafted to simplify your migration process. Dive into the step-by-step approach and discover how to leverage BigQuery's SQL for effective data processing. #BigQuery #DataMigration #HiveUDFs  
[https://www.aliz.ai/en/blog/step-by-step-guide-to-migrating-hive-custom-functions-to-bigquery-sql-udfs](https://www.aliz.ai/en/blog/step-by-step-guide-to-migrating-hive-custom-functions-to-bigquery-sql-udfs) ",2,0,Constant-Collar9129,2024-01-23 14:16:29,https://www.reddit.com/r/dataengineering/comments/19dpdzg/how_to_migrate_hive_custom_functions_to_bigquery/,False,False,False,False
19doe1t,Airflow backfill via UI,"Is it possible to backfill via the Airflow UI? I know that it's possible via CLI, but I have a requirement to do it over the UI, did some searching couldn't find much info, wonder if it's possible to do via UI. ",2,1,cjj1120,2024-01-23 13:27:05,https://www.reddit.com/r/dataengineering/comments/19doe1t/airflow_backfill_via_ui/,False,False,False,False
19dnoxa,"Parquet Row Group Sizing, how do you choose your sizing?","Like any other optimization, parquet row group sizing has trade-offs, when do you choose to go for more row groups or less row groups?",2,0,AMDataLake,2024-01-23 12:49:48,https://www.reddit.com/r/dataengineering/comments/19dnoxa/parquet_row_group_sizing_how_do_you_choose_your/,False,False,False,False
19du2hj,Getting a job asap or go full learning?,"Hi guys,

I've graduated my bachelor and decided to put my time in Data Engineering cause it seems more interesting than other fields. I've been looking at what the fundamentals are and if I understand correctly I should focus on getting to an advanced level on Python and SQL first before moving to some suite of tools to build my first solo-project to demonstrate I can actually be of use to a company.

I come to ask you pros/cons on this two approaches for the next months: 

* Get a back-end developer job in my vicinity as quick as possible, even if it is not Data Engineering related, just to get some experience on my resume and not look like a complete beginner to future DE recruiters; i would study on a portion of my free time.
* Not get a job and just spend my days studying DE and making that project to get good quicker than the first option; I don't know how long that would take and if being unemployed for that amount of time would look very bad on my resume. To give more info, I am not in a financial situation where I need a job to keep floating.",1,5,Di4mond4rr3l,2024-01-23 17:44:15,https://www.reddit.com/r/dataengineering/comments/19du2hj/getting_a_job_asap_or_go_full_learning/,False,False,False,False
19dt9fn,How to model and save these two data source.,"In a manufactoring project I have two sensors:

1. Sensor 1: temperature data sampled at 10Hz continously.
2. Sensor 2: 3-axis accelerometer data sampled at 6kHz in a window of 10s every 10m. In other words, every 10m I have a windows of 10s containing 10\*6k=60000 records. Every record has a timestamp, a value for axis x, y, and z. 60000x4 table.

On sensors 2 data:

The ideas is to perform, at some stage, a ""data engineering"" phase where the ""raw data"" from sensors 2 mentionted before are processed in order to output some informative and less-dimensional data. For instance, letting the inputs be:

* Window 1 of 10s, sampled at 6kHz, every 10m has 60000x4 data (timestamp, x, y, z).
* Window 2 of 10s, sampled at 6kHz, every 10m has 60000x4 data (timestamp, x, y, z).
* ...
* Window M: ...

The output would be:

* MxN table/matrix (windows\_id, timestamp\_start\_window, feature1, feature2, ..., feature N-2).

Where N is the number of synthetic features created (e.g. mean x, median y, max z, min z, etc..) plus a timestamp (for instance the start of the window) and the windows ID and M is the number of windows.

If I want to save these two data raw sources (inputs) into a file system or database, and also the synthetic data (outputs), how would you save them in order to be flexible and efficient with later data analysis? The analysis will be based on time-series algorithm in order to dedect patterns and anomaly detections.

Note, the two sensors are an example of different sources with different requirements but the use case is not ""that simple"". I would like to discuss the design of modeling and storing/extraction of these time-series with easiness, scaling, and efficiency in mind.

&#x200B;

&#x200B;",1,0,Plenty-Button8465,2024-01-23 17:07:26,https://www.reddit.com/r/dataengineering/comments/19dt9fn/how_to_model_and_save_these_two_data_source/,False,False,False,False
19dsy6j,Maybe bombed this interview question? Asked about data validation and accuracy,"I had a phone screen yesterday for a data analytics engineer role. 

I was asked how do I monitor the data pipelines and ensure its accuracy. My response was, I enjoy working with the end user and am really great about getting constant feedback. I said how in my current role, as a Product Engineer, i spend a lot of time with users and going through user data/feedback to determine the success of a feature. 

Now that I'm thinking about it -- they may have been asking me what tools I use.

Earlier, I described a FastAPI poller I built that detected any new data from an AWS EC2 where I dumped everything. Then it took the new data, transformed it in into the ""pretty"" staging structures then updated the appropriate (separate) EC2 tables. In this case, I use pydantic models to ensure that the data is structured correctly. Any issues I can see in the logs. 

Now that time has passed I think they were asking about testing (in dbt) and monitoring tools. 

Is it worth following-up and clarifying?",2,3,No_Egg1537,2024-01-23 16:54:08,https://www.reddit.com/r/dataengineering/comments/19dsy6j/maybe_bombed_this_interview_question_asked_about/,False,False,False,False
19dsv7p,Copy Data from Sharepoint to the Azure Blob storage.,"I need to move and schedule the data copy operation from the company Sharepoint to the Azure Blob Storage. I am new to the Azure and found two candidate solutions.

* Use Azure Data Factory predefined jobs.
* Use Azure Functions with Python scripts.

From what I gathered Azure Functions would be cheaper, this is not super hard to code so I wonder if there is any benefit to the ADF. Do you have any thoughts/recommendations?",1,0,bartosaq,2024-01-23 16:50:45,https://www.reddit.com/r/dataengineering/comments/19dsv7p/copy_data_from_sharepoint_to_the_azure_blob/,False,False,False,False
19dsg0t,Navigating the Path to Data Engineering,"Hey guys I've recently graduated from college  and have completed chemical engineering and I want to transition to  data domain . I  need your help guys to get the answer to few of my questions 

1) What are some specialized areas within data engineering, and how can one decide on a niche to focus on.

2)Are there specific skills or certifications that stand out in the job market?

3)What key elements should be highlighted on a resume to catch the attention of recruiters?",1,1,No-Salt5525,2024-01-23 16:33:05,https://www.reddit.com/r/dataengineering/comments/19dsg0t/navigating_the_path_to_data_engineering/,False,False,False,False
19dq2rf,Cronitor & Airflow,Is anyone using Cronitor to monitor their Airflow instance? Would be curious to hear what the value add is to have another tool in the loop.,1,0,Express-Comb8675,2024-01-23 14:49:15,https://www.reddit.com/r/dataengineering/comments/19dq2rf/cronitor_airflow/,False,False,False,False
19dojoh,How to manage drift between dbt and Redshift,"Hello !

I am managing a team of 5 data engineers for the analytics of a retail compagnie and we use dbt and Redshift. The team is 5 years old and we have an accumulation of old databases that were not removed + manual changed that were made through the console and are not under control.  
I have been searching but didn't find good tools to monitor it (would love to get something that points the differences between dbt and the real state of snowflake).  
Any recommendations?",1,1,New_Detective_1363,2024-01-23 13:35:08,https://www.reddit.com/r/dataengineering/comments/19dojoh/how_to_manage_drift_between_dbt_and_redshift/,False,False,False,False
19dniju,The Approach vs Technology Confusion: Where do Data Products Fit In?,,1,0,growth_man,2024-01-23 12:39:40,https://moderndata101.substack.com/p/the-approach-vs-technology-confusion,False,False,False,False
19dmm6t,Data Vault or Dimensional Modelling?,"Hi,

I am working on data engineering project, and am thinking what data modelling technique to use? Can someone give a suggestion?

Thank you very much for reading and helping.",1,1,Aggressive-Nebula-44,2024-01-23 11:45:55,https://www.reddit.com/r/dataengineering/comments/19dmm6t/data_vault_or_dimensional_modelling/,False,False,False,False
19djcsf,New player to the game,"I recently started as a Data Analyst after a career change. As with many others, I was quickly identified as a candidate for a JDE role. Ever since (~2 months) I have been mainly working with spatial data in FME and handling pipelines and dashboards.

My organization have suggested I take some training on spatial data, but I also want to know where else I can apply myself to progress becoming a Data Engineer. Any tips on specific skills, certifications, or experiences that could help me? I'd say I have moderate ability with SQL and basic Python understanding. Should I be putting all my time in data handling / manipulation in Python? Should I be looking at any other ETL tools (we currently use FME exclusively). Should I be considering database managent?? 

Any help and advice is really appreciated!",2,1,BrittleTupperwareBox,2024-01-23 07:57:46,https://www.reddit.com/r/dataengineering/comments/19djcsf/new_player_to_the_game/,False,False,False,False
19dega8,Using Airflow to execute preprocessing data for machine learning,"Hi guys, I began using Airflow recently. I am using it for my process server which user can import their file to data lake. Then I will pass these file location, ways to process and processed file destination to **Airflow** webserver throught API. **CeleryExecutor** then will add job to **rabbitMQ** and **workers** will execute that **DAG**. **DAG** contain 3 task: **Extract** (download data from data lake and read it as dataframe), **Transform** (perform some transformation to that df) and **Load** (load processed df back to data lake). My question is Is it common to reload data from data lake every time a dag is executed. I mean if user want to perform many process separately, then workers will have to reload data to RAM over and over again. Is there any way to optimize this or is there any better way to do this? Thanks for your reading ",1,7,resrrdttrt,2024-01-23 03:06:29,https://www.reddit.com/r/dataengineering/comments/19dega8/using_airflow_to_execute_preprocessing_data_for/,False,False,False,False
19daecg,Need career advice,"Im currently doing my final year in btech Artificial Intelligence and Data Science and I got an internship through placements at a startup . The thing is , this company made me to handle a client with no prior experience (literally 0) and makes me do everything under a module . As an intern I want to learn more and help but Im stressing  myself working on pipelines, modifying transformation logic , fixing pipelines, documentation, cloud , writing apis and more . Im extremely exhausted and feel Ive wasted my time here .And at time I feel if i stayed back and just learnt stuff I would have got a better job.  Is this a common thing out there ?? (Ps : my stipend is only 155 dollars / month and i still handle the client )",1,1,pradishhh,2024-01-22 23:53:09,https://www.reddit.com/r/dataengineering/comments/19daecg/need_career_advice/,False,False,False,False
19d54ho,Switching to data analyst position from engineering?,"Hi all, I’ve been a junior DE for around 8 months now. I lack a CS degree and don’t currently plan to get a masters degree, though I’m pretty committed to self learning. At the moment however, I’m not 100% set on being a DE. I mostly ended up here due to placements after a rotational software engineering program. 

If I get a different position within my org as an analyst, would it be bad for my career? I feel that I may be a good fit for analytics as I used to work in an R&D science & engineering department for a manufacturer and did a ton of analytics on lab data. I think I’d enjoy the work. 

Would this be a step backwards, as analysts are typically considered to be less technical than engineers? 
I see a lot of people trying to switch from analytics into data engineering and am wondering if I’m crazy for trying the reverse haha.",1,3,aaloo_chaat,2024-01-22 20:15:52,https://www.reddit.com/r/dataengineering/comments/19d54ho/switching_to_data_analyst_position_from/,False,False,False,False
19d2pj8,How to become a committer,"Background: Work in strategy and ops | Non-technical

Are there open source projects that accept volunteers from non-technical backgrounds?

How do I get started?

What would be good open source projects to target?",1,0,ProfessorFinanceBro,2024-01-22 18:35:31,https://www.reddit.com/r/dataengineering/comments/19d2pj8/how_to_become_a_committer/,False,False,False,False
