id,title,selftext,score,num_comments,author,created_utc,url,over_18,edited,spoiler,stickied
19d2m9p,Need Help with Interview Practice,"I took a job as a data and analytics engineer two years ago. The job is very limited in its growth and skill ability, and the majority of the harder data engineering work is done through an out-of-the-country contracting firm. My position is mainly translating requirements for them to be able to build and maintain. I am looking to leave this firm to continue growing my skill set, but I am out of practice interviewing, especially in the current market. I am specifically targeting Sr. Data Engineer positions with growth potential as either a Staff Engineer or a Data Architect. Does anyone have any groups for mock interviews and/or study curriculum in order to review for interviews? I specifically need assistance in Python algorithms and system design.",1,1,Jonesy-2010,2024-01-22 18:31:56,https://www.reddit.com/r/dataengineering/comments/19d2m9p/need_help_with_interview_practice/,False,False,False,False
19dm78e,GIST OF DRAGONFLY {www.dragonflydatahq.com} :-A No Nonsense Data Quality Monitoring Platform,"1) Dragonfly checks a company's data processing steps to create pipelines, making sure the data flows correctly.

2) It connects health checks with components, allowing companies to configure listeners for events and get notified when data events occur.

3.) Dragonfly protects against incorrect data by performing Health Checks that assess various aspects of data and generate a Data Confidence Rating (DCR).

4.) Users can choose from a library of pre-written data quality checks or use Dragonfly GPT to convert simple English demands into Health Checks.

5.) Dragonfly is an API-first platform, allowing integration with various databases and data platforms, ensuring data quality reports are easily accessible.

6.) Dragonfly does not modify data, can work with read-only access, and does not copy data from the warehouse, maintaining the Data Confidence Rating (DCR).

7.) Dragonfly converts checks and DCR reports into events, enabling users to receive alerts via email or SMS, or integrate events into systems like Apache Kafka or AWS SNS.

8) As an API-first platform, Dragonfly integrates smoothly with various databases, data warehouses, and platforms like PostgreSQL, MySQL, AWS Redshift, and more

9.)Dragonfly is a Data Quality Monitoring platform that aims to make data processing secure and accurate for companies.  


**Would love to have your valuable feedback and reviews as i am one of the co-founders for this B2B Saas product**   
",0,1,Decent_Ice1528,2024-01-23 11:19:23,https://www.reddit.com/r/dataengineering/comments/19dm78e/gist_of_dragonfly_wwwdragonflydatahqcom_a_no/,False,False,False,False
19djvg7,Analyzing Hugging Face Datasets with Databend,,0,1,PsiACE,2024-01-23 08:35:56,https://www.databend.com/blog/2024-01-18-analyzing-hugging-face-datasets-with-databend/,False,False,False,False
19dmods,How to handle one to many relationships in tables in a dashboard?,"Like for example, you have two tables - Orders and products. 
Orders table contains - user_id, product_id, num_orders, and 
Products table contains - product_id, product_category. 

Now, one product can belong to multiple categories. So one entry in order table might get mapped to multiple entries in products table which leads to data duplicity. Like, total orders per category or per user might be misleading.

What are the ways to handle this?",0,8,divyaanshDev,2024-01-23 11:49:42,https://www.reddit.com/r/dataengineering/comments/19dmods/how_to_handle_one_to_many_relationships_in_tables/,False,False,False,False
19d9p1u,CEO of Data Engineer Academy Here - Q & A Next 24 Hours. Ask me anything!,"Ask me anything related to data, data engineering, your app process, a blueprint, etc.

My goal is to provide as much value as I possibly can as a thank you to this community.

&#x200B;

We’ve helped hundreds privately and thousands in total to get a role in the data space. We work with staffing agencies, companies, and deal with thousands of apps getting sent out every month. Today, I want to share that inside view in hopes that someone can benefit from it.

&#x200B;

I’ll do my best to get to every question!",0,35,chrisgarzon19,2024-01-22 23:22:46,https://www.reddit.com/r/dataengineering/comments/19d9p1u/ceo_of_data_engineer_academy_here_q_a_next_24/,False,False,False,False
